[
  {
    "id": "openai-skills:cloudflare-deploy",
    "name": "cloudflare-deploy",
    "slug": "cloudflare-deploy",
    "description": "Deploy applications and infrastructure to Cloudflare using Workers, Pages, and related platform services. Use when the user asks to deploy, host, publish, or set up a project on Cloudflare.",
    "trust": "A",
    "source": {
      "repo": "https://github.com/openai/skills",
      "ref": "main",
      "commit": "2c9ebb321958f64aa9414b46e4240901e2b9e1a9",
      "path": "skills/.curated/cloudflare-deploy"
    },
    "license": {
      "spdx": "Apache-2.0",
      "file": "LICENSE.txt"
    },
    "layout": {
      "has_scripts": false,
      "has_references": true,
      "has_assets": true,
      "has_openai_yaml": true
    },
    "risk": {
      "level": "low",
      "flags": []
    },
    "tags": [],
    "install": [
      {
        "method": "codex_skill_installer",
        "hint": "$skill-installer install https://github.com/openai/skills/tree/main/skills/.curated/cloudflare-deploy"
      }
    ]
  },
  {
    "id": "openai-skills:develop-web-game",
    "name": "develop-web-game",
    "slug": "develop-web-game",
    "description": "Use when Codex is building or iterating on a web game (HTML/JS) and needs a reliable development + testing loop: implement small changes, run a Playwright-based test script with short input bursts and intentional pauses, inspect screenshots/text, and review console errors with re",
    "trust": "A",
    "source": {
      "repo": "https://github.com/openai/skills",
      "ref": "main",
      "commit": "2c9ebb321958f64aa9414b46e4240901e2b9e1a9",
      "path": "skills/.curated/develop-web-game"
    },
    "license": {
      "spdx": "Apache-2.0",
      "file": "LICENSE.txt"
    },
    "layout": {
      "has_scripts": true,
      "has_references": true,
      "has_assets": true,
      "has_openai_yaml": true
    },
    "risk": {
      "level": "high",
      "flags": [
        "fs_write"
      ]
    },
    "tags": [],
    "install": [
      {
        "method": "codex_skill_installer",
        "hint": "$skill-installer install https://github.com/openai/skills/tree/main/skills/.curated/develop-web-game"
      }
    ]
  },
  {
    "id": "openai-skills:figma",
    "name": "figma",
    "slug": "figma",
    "description": "Use the Figma MCP server to fetch design context, screenshots, variables, and assets from Figma, and to translate Figma nodes into production code. Trigger when a task involves Figma URLs, node IDs, design-to-code implementation, or Figma MCP setup and troubleshooting.",
    "trust": "A",
    "source": {
      "repo": "https://github.com/openai/skills",
      "ref": "main",
      "commit": "2c9ebb321958f64aa9414b46e4240901e2b9e1a9",
      "path": "skills/.curated/figma"
    },
    "license": {
      "spdx": "Apache-2.0",
      "file": "LICENSE.txt"
    },
    "layout": {
      "has_scripts": false,
      "has_references": true,
      "has_assets": true,
      "has_openai_yaml": true
    },
    "risk": {
      "level": "low",
      "flags": []
    },
    "tags": [],
    "install": [
      {
        "method": "codex_skill_installer",
        "hint": "$skill-installer install https://github.com/openai/skills/tree/main/skills/.curated/figma"
      }
    ]
  },
  {
    "id": "openai-skills:figma-implement-design",
    "name": "figma-implement-design",
    "slug": "figma-implement-design",
    "description": "Translate Figma nodes into production-ready code with 1:1 visual fidelity using the Figma MCP workflow (design context, screenshots, assets, and project-convention translation). Trigger when the user provides Figma URLs or node IDs, or asks to implement designs or components that",
    "trust": "A",
    "source": {
      "repo": "https://github.com/openai/skills",
      "ref": "main",
      "commit": "2c9ebb321958f64aa9414b46e4240901e2b9e1a9",
      "path": "skills/.curated/figma-implement-design"
    },
    "license": {
      "spdx": "Apache-2.0",
      "file": "LICENSE.txt"
    },
    "layout": {
      "has_scripts": false,
      "has_references": false,
      "has_assets": true,
      "has_openai_yaml": true
    },
    "risk": {
      "level": "low",
      "flags": []
    },
    "tags": [],
    "install": [
      {
        "method": "codex_skill_installer",
        "hint": "$skill-installer install https://github.com/openai/skills/tree/main/skills/.curated/figma-implement-design"
      }
    ]
  },
  {
    "id": "openai-skills:gh-address-comments",
    "name": "gh-address-comments",
    "slug": "gh-address-comments",
    "description": "Help address review/issue comments on the open GitHub PR for the current branch using gh CLI; verify gh auth first and prompt the user to authenticate if not logged in.",
    "trust": "A",
    "source": {
      "repo": "https://github.com/openai/skills",
      "ref": "main",
      "commit": "2c9ebb321958f64aa9414b46e4240901e2b9e1a9",
      "path": "skills/.curated/gh-address-comments"
    },
    "license": {
      "spdx": "Apache-2.0",
      "file": "LICENSE.txt"
    },
    "layout": {
      "has_scripts": true,
      "has_references": false,
      "has_assets": true,
      "has_openai_yaml": true
    },
    "risk": {
      "level": "medium",
      "flags": [
        "shell_exec"
      ]
    },
    "tags": [],
    "install": [
      {
        "method": "codex_skill_installer",
        "hint": "$skill-installer install https://github.com/openai/skills/tree/main/skills/.curated/gh-address-comments"
      }
    ]
  },
  {
    "id": "openai-skills:gh-fix-ci",
    "name": "gh-fix-ci",
    "slug": "gh-fix-ci",
    "description": "Use when a user asks to debug or fix failing GitHub PR checks that run in GitHub Actions; use `gh` to inspect checks and logs, summarize failure context, draft a fix plan, and implement only after explicit approval. Treat external providers (for example Buildkite) as out of scope",
    "trust": "A",
    "source": {
      "repo": "https://github.com/openai/skills",
      "ref": "main",
      "commit": "2c9ebb321958f64aa9414b46e4240901e2b9e1a9",
      "path": "skills/.curated/gh-fix-ci"
    },
    "license": {
      "spdx": "Apache-2.0",
      "file": "LICENSE.txt"
    },
    "layout": {
      "has_scripts": true,
      "has_references": false,
      "has_assets": true,
      "has_openai_yaml": true
    },
    "risk": {
      "level": "medium",
      "flags": [
        "shell_exec"
      ]
    },
    "tags": [],
    "install": [
      {
        "method": "codex_skill_installer",
        "hint": "$skill-installer install https://github.com/openai/skills/tree/main/skills/.curated/gh-fix-ci"
      }
    ]
  },
  {
    "id": "openai-skills:jupyter-notebook",
    "name": "jupyter-notebook",
    "slug": "jupyter-notebook",
    "description": "Use when the user asks to create, scaffold, or edit Jupyter notebooks (`.ipynb`) for experiments, explorations, or tutorials; prefer the bundled templates and run the helper script `new_notebook.py` to generate a clean starting notebook.",
    "trust": "A",
    "source": {
      "repo": "https://github.com/openai/skills",
      "ref": "main",
      "commit": "2c9ebb321958f64aa9414b46e4240901e2b9e1a9",
      "path": "skills/.curated/jupyter-notebook"
    },
    "license": {
      "spdx": "Apache-2.0",
      "file": "LICENSE.txt"
    },
    "layout": {
      "has_scripts": true,
      "has_references": true,
      "has_assets": true,
      "has_openai_yaml": true
    },
    "risk": {
      "level": "low",
      "flags": []
    },
    "tags": [],
    "install": [
      {
        "method": "codex_skill_installer",
        "hint": "$skill-installer install https://github.com/openai/skills/tree/main/skills/.curated/jupyter-notebook"
      }
    ]
  },
  {
    "id": "openai-skills:linear",
    "name": "linear",
    "slug": "linear",
    "description": "Manage issues, projects & team workflows in Linear. Use when the user wants to read, create or updates tickets in Linear.",
    "trust": "A",
    "source": {
      "repo": "https://github.com/openai/skills",
      "ref": "main",
      "commit": "2c9ebb321958f64aa9414b46e4240901e2b9e1a9",
      "path": "skills/.curated/linear"
    },
    "license": {
      "spdx": "Apache-2.0",
      "file": "LICENSE.txt"
    },
    "layout": {
      "has_scripts": false,
      "has_references": false,
      "has_assets": true,
      "has_openai_yaml": true
    },
    "risk": {
      "level": "low",
      "flags": []
    },
    "tags": [],
    "install": [
      {
        "method": "codex_skill_installer",
        "hint": "$skill-installer install https://github.com/openai/skills/tree/main/skills/.curated/linear"
      }
    ]
  },
  {
    "id": "openai-skills:netlify-deploy",
    "name": "netlify-deploy",
    "slug": "netlify-deploy",
    "description": "Deploy web projects to Netlify using the Netlify CLI (`npx netlify`). Use when the user asks to deploy, host, publish, or link a site/repo on Netlify, including preview and production deploys.",
    "trust": "A",
    "source": {
      "repo": "https://github.com/openai/skills",
      "ref": "main",
      "commit": "2c9ebb321958f64aa9414b46e4240901e2b9e1a9",
      "path": "skills/.curated/netlify-deploy"
    },
    "license": {
      "spdx": "Apache-2.0",
      "file": "LICENSE.txt"
    },
    "layout": {
      "has_scripts": false,
      "has_references": true,
      "has_assets": true,
      "has_openai_yaml": true
    },
    "risk": {
      "level": "low",
      "flags": []
    },
    "tags": [],
    "install": [
      {
        "method": "codex_skill_installer",
        "hint": "$skill-installer install https://github.com/openai/skills/tree/main/skills/.curated/netlify-deploy"
      }
    ]
  },
  {
    "id": "openai-skills:openai-docs",
    "name": "openai-docs",
    "slug": "openai-docs",